{
  "artifacts": [
    {
      "diagnostic_code": null,
      "id": "summary",
      "path": "summary.txt",
      "redactions": {},
      "sha256": "c7c09bb49ec0b854fae30e59f724f8352257fa8a1180962b65abce58c46ef973",
      "size_bytes": 38,
      "status": "collected",
      "truncated": false
    },
    {
      "diagnostic_code": "JOURNAL_PERMISSION_DENIED",
      "id": "journal",
      "redactions": {},
      "status": "skipped",
      "truncated": false
    }
  ],
  "collection": {
    "finished_at": "2026-08-30T12:00:01Z",
    "privilege": "non-root",
    "service": "nginx.service",
    "since_seconds": 7200,
    "started_at": "2026-08-30T12:00:00Z",
    "status": "partial"
  },
  "exclusions": [],
  "known_limitations": [
    "Synthetic contract fixture; no host evidence was collected."
  ],
  "limits": {
    "collector_timeout_seconds": 10,
    "journal_range_seconds": 7200,
    "max_archive_bytes": 8388608,
    "max_artifact_bytes": 4194304,
    "max_journal_records": 1000,
    "max_message_bytes": 8192,
    "max_total_bytes": 16777216
  },
  "schema_version": 1,
  "tool": {
    "name": "incident-pack",
    "version": "0.1.0"
  }
}
